{
  "$schema": "https://raw.githubusercontent.com/dora56/dotnet-coupling/main/schemas/dotnet-coupling-report.schema.json",
  "schemaVersion": "0.1",
  "tool": "dotnet-coupling",
  "version": "0.5.0",
  "analysis": {
    "path": "<FIXTURE>",
    "mode": "syntax-only",
    "files": 2,
    "components": 2,
    "couplings": {
      "total": 1,
      "internal": 1,
      "external": 0
    },
    "gitUsed": false,
    "gitMonths": 6
  },
  "grade": {
    "letter": "C",
    "display": "Room for improvement",
    "basis": "issue-density",
    "rationale": "High issues or elevated medium issue density were found."
  },
  "scores": {
    "averageBalanceScore": 0.75
  },
  "issueCounts": {
    "critical": 0,
    "high": 0,
    "medium": 1,
    "low": 0
  },
  "issues": [
    {
      "type": "GlobalComplexity",
      "severity": "Medium",
      "source": "Fixture.Global.Api.Handler",
      "target": "Fixture.Global.Infrastructure.Repository",
      "score": 0.75,
      "problem": "Strong coupling spans a namespace or project boundary.",
      "recommendation": "Introduce an interface, move the dependency closer, or add a port/adapter.",
      "location": {
        "file": "<FIXTURE>/Api/Handler.cs",
        "line": 7
      }
    }
  ],
  "manifest": {
    "confidence": "syntax-only",
    "runNotes": [
      "Semantic symbol resolution is not enabled."
    ],
    "blindSpots": [
      {
        "kind": "Semantic",
        "description": "Semantic symbol resolution is not enabled."
      },
      {
        "kind": "DI",
        "description": "DI container runtime resolution is not analyzed in syntax-only mode."
      },
      {
        "kind": "Reflection",
        "description": "Reflection and dynamic calls may be incomplete."
      },
      {
        "kind": "Generated",
        "description": "Generated code is excluded by default."
      }
    ]
  }
}
